"UPRN","ORGANISATION","Sub_Building_No","Sub_Building_Name","Building_Number","THOROUGHFARE","LOCALITY","TOWN","POSTCODE","FULL_ADDRESS","WARD_NAME","PRIMARY_DESCRIPTION","SECONDARY_DESCRIPTION","TERTIARY_DESCRIPTION","X","Y","LOGICAL_STATUS","RPA_DESCRIPTION","PARTIAL_ADDRESS"
10022904993,"","","TUCKTON ROAD PUBLIC CONVENIENCIES","","TUCKTON ROAD","","BOURNEMOUTH","","TUCKTON ROAD PUBLIC CONVENIENCIES, TUCKTON ROAD, BOURNEMOUTH","EAST SOUTHBOURNE AND TUCKTON","Commercial","Community Services","Public Conveniences",414794.0000,92099.0000,"Approved Preferred","Visual centre","TUCKTON ROAD PUBLIC CONVENIENCIES, TUCKTON ROAD"
10023870288,"","PUBLIC CONVENIENCES","BOSCOMBE BUS STATION","","ASHLEY ROAD","","BOURNEMOUTH","","PUBLIC CONVENIENCES, BOSCOMBE BUS STATION, ASHLEY ROAD, BOURNEMOUTH","BOSCOMBE WEST","Commercial","Community Services","Public Conveniences",411533.6900,92065.0200,"Approved Preferred","Visual centre","BOSCOMBE BUS STATION, ASHLEY ROAD"
10023870289,"","","KINGS PARK PUBLIC CONVENIENCES","","ASHLEY ROAD","","BOURNEMOUTH","","KINGS PARK PUBLIC CONVENIENCES, ASHLEY ROAD, BOURNEMOUTH","LITTLEDOWN AND IFORD","Commercial","Community Services","Public Conveniences",411228.9900,92542.8700,"Approved Preferred","Visual centre","KINGS PARK PUBLIC CONVENIENCES, ASHLEY ROAD"
10023870290,"","","HENGISTBURY HEAD PUBLIC CONVENIENCES","","HENGISTBURY HEAD","","BOURNEMOUTH","","HENGISTBURY HEAD PUBLIC CONVENIENCES, HENGISTBURY HEAD, BOURNEMOUTH","EAST SOUTHBOURNE AND TUCKTON","Commercial","Community Services","Public Conveniences",418076.5500,90759.4800,"Approved Preferred","Visual centre","HENGISTBURY HEAD PUBLIC CONVENIENCES, HENGISTBURY HEAD"
10023870291,"","","EAST OVERCLIFF LIFT PUBLIC CONVENIENCES","","EAST OVERCLIFF DRIVE","","BOURNEMOUTH","","EAST OVERCLIFF LIFT PUBLIC CONVENIENCES, EAST OVERCLIFF DRIVE, BOURNEMOUTH","CENTRAL","Commercial","Community Services","Public Conveniences",409525.6300,90955.1700,"Approved Preferred","Visual centre","EAST OVERCLIFF LIFT PUBLIC CONVENIENCES, EAST OVERCLIFF DRIVE"
10023870292,"","","FIRBANK ROAD PUBLIC CONVENIENCES","","FIRBANK ROAD","","BOURNEMOUTH","","FIRBANK ROAD PUBLIC CONVENIENCES, FIRBANK ROAD, BOURNEMOUTH","WINTON EAST","Commercial","Community Services","Public Conveniences",409844.1900,93642.4700,"Approved Preferred","Visual centre","FIRBANK ROAD PUBLIC CONVENIENCES, FIRBANK ROAD"
10023870293,"","","FISHERMANS WALK GARDENS PUBLIC CONVENIENCES","","FISHERMANS WALK GARDENS","","BOURNEMOUTH","","FISHERMANS WALK GARDENS PUBLIC CONVENIENCES, FISHERMANS WALK GARDENS, BOURNEMOUTH","BOSCOMBE EAST","Commercial","Community Services","Public Conveniences",412935.2000,91813.0800,"Approved Preferred","Visual centre","FISHERMANS WALK GARDENS PUBLIC CONVENIENCES, FISHERMANS WALK GARDENS"
10023870294,"","","FISHERMANS OVERCLIFF PUBLIC CONVENIENCES","","SOUTHBOURNE OVERCLIFF DRIVE","","BOURNEMOUTH","","FISHERMANS OVERCLIFF PUBLIC CONVENIENCES, SOUTHBOURNE OVERCLIFF DRIVE, BOURNEMOUTH","BOSCOMBE EAST","Commercial","Community Services","Public Conveniences",412983.0900,91361.6900,"Approved Preferred","Visual centre","FISHERMANS OVERCLIFF PUBLIC CONVENIENCES, SOUTHBOURNE OVERCLIFF DRIVE"
10023870295,"","","GLEN FERN ROAD PUBLIC CONVENIENCES","","GLEN FERN ROAD","","BOURNEMOUTH","","GLEN FERN ROAD PUBLIC CONVENIENCES, GLEN FERN ROAD, BOURNEMOUTH","CENTRAL","Commercial","Community Services","Public Conveniences",409052.7100,91292.3700,"Approved Preferred","Visual centre","GLEN FERN ROAD PUBLIC CONVENIENCES, GLEN FERN ROAD"
10023870296,"","","LESLIE ROAD PUBLIC CONVENIENCES","","LESLIE ROAD","","BOURNEMOUTH","","LESLIE ROAD PUBLIC CONVENIENCES, LESLIE ROAD, BOURNEMOUTH","WINTON EAST","Commercial","Community Services","Public Conveniences",408564.6100,93486.0100,"Approved Preferred","Visual centre","LESLIE ROAD PUBLIC CONVENIENCES, LESLIE ROAD"
10023870297,"","","LOWER GARDENS PUBLIC CONVENIENCES","","LOWER GARDENS","","BOURNEMOUTH","","LOWER GARDENS PUBLIC CONVENIENCES, LOWER GARDENS, BOURNEMOUTH","CENTRAL","Commercial","Community Services","Public Conveniences",408602.4600,91076.5400,"Approved Preferred","Visual centre","LOWER GARDENS PUBLIC CONVENIENCES, LOWER GARDENS"
10023870298,"","","MALVERN ROAD PUBLIC CONVENIENCES","","MALVERN ROAD","","BOURNEMOUTH","","MALVERN ROAD PUBLIC CONVENIENCES, MALVERN ROAD, BOURNEMOUTH","MOORDOWN","Commercial","Community Services","Public Conveniences",409005.0200,95104.2400,"Approved Preferred","Visual centre","MALVERN ROAD PUBLIC CONVENIENCES, MALVERN ROAD"
10023870299,"","","MILBURN ROAD PUBLIC CONVENIENCES","","MILBURN ROAD","","BOURNEMOUTH","","MILBURN ROAD PUBLIC CONVENIENCES, MILBURN ROAD, BOURNEMOUTH","WESTBOURNE AND WEST CLIFF","Commercial","Community Services","Public Conveniences",406942.5200,91577.8200,"Approved Preferred","Visual centre","MILBURN ROAD PUBLIC CONVENIENCES, MILBURN ROAD"
10023870300,"","","MILLHAMS ROAD PUBLIC CONVENIENCES","","MILLHAMS ROAD","","BOURNEMOUTH","","MILLHAMS ROAD PUBLIC CONVENIENCES, MILLHAMS ROAD, BOURNEMOUTH","KINSON NORTH","Commercial","Community Services","Public Conveniences",407065.8400,96641.3900,"Approved Preferred","Visual centre","MILLHAMS ROAD PUBLIC CONVENIENCES, MILLHAMS ROAD"
10023870301,"","","POOLE HILL PUBLIC CONVENIENCES","","POOLE HILL","","BOURNEMOUTH","","POOLE HILL PUBLIC CONVENIENCES, POOLE HILL, BOURNEMOUTH","WESTBOURNE AND WEST CLIFF","Commercial","Community Services","Public Conveniences",408072.5000,91103.4200,"Approved Preferred","Visual centre","POOLE HILL PUBLIC CONVENIENCES, POOLE HILL"
10023870302,"","","REDHILL PUBLIC CONVENIENCES","","REDHILL AVENUE","","BOURNEMOUTH","","REDHILL PUBLIC CONVENIENCES, REDHILL AVENUE, BOURNEMOUTH","REDHILL AND NORTHBOURNE","Commercial","Community Services","Public Conveniences",408155.6200,94733.6700,"Approved Preferred","Visual centre","REDHILL PUBLIC CONVENIENCES, REDHILL AVENUE"
10023870303,"","","RICHMOND HILL PUBLIC CONVENIENCES","","RICHMOND HILL","","BOURNEMOUTH","","RICHMOND HILL PUBLIC CONVENIENCES, RICHMOND HILL, BOURNEMOUTH","CENTRAL","Commercial","Community Services","Public Conveniences",408851.1600,91395.6100,"Approved Preferred","Visual centre","RICHMOND HILL PUBLIC CONVENIENCES, RICHMOND HILL"
10023870304,"","","SEABOURNE ROAD PUBLIC CONVENIENCES","","SEABOURNE ROAD","","BOURNEMOUTH","","SEABOURNE ROAD PUBLIC CONVENIENCES, SEABOURNE ROAD, BOURNEMOUTH","BOSCOMBE EAST","Commercial","Community Services","Public Conveniences",412510.4291,92359.1117,"Approved Preferred","Visual centre","SEABOURNE ROAD PUBLIC CONVENIENCES, SEABOURNE ROAD"
10023870306,"","","WESTOVER ROAD PUBLIC CONVENIENCES","","WESTOVER ROAD","","BOURNEMOUTH","","WESTOVER ROAD PUBLIC CONVENIENCES, WESTOVER ROAD, BOURNEMOUTH","CENTRAL","Commercial","Community Services","Public Conveniences",408802.3400,91097.1700,"Approved Preferred","Visual centre","WESTOVER ROAD PUBLIC CONVENIENCES, WESTOVER ROAD"
10023870307,"","","BOURNEMOUTH TRAVEL INTERCHANGE PUBLIC CONVENIENCES","","STATION APPROACH","","BOURNEMOUTH","","BOURNEMOUTH TRAVEL INTERCHANGE PUBLIC CONVENIENCES, STATION APPROACH, BOURNEMOUTH","CENTRAL","Commercial","Community Services","Public Conveniences",409644.6800,91902.4500,"Approved Preferred","Visual centre","BOURNEMOUTH TRAVEL INTERCHANGE PUBLIC CONVENIENCES, STATION APPROACH"
10023870308,"","","PELHAMS PARK PUBLIC CONVENIENCES","","PELHAMS PARK","","BOURNEMOUTH","","PELHAMS PARK PUBLIC CONVENIENCES, PELHAMS PARK, BOURNEMOUTH","KINSON NORTH","Commercial","Community Services","Public Conveniences",407091.0900,96850.2200,"Approved Preferred","Visual centre","PELHAMS PARK PUBLIC CONVENIENCES, PELHAMS PARK"
10023870309,"","","RIVERSIDE PUBLIC CONVENIENCES","","WICK LANE","","BOURNEMOUTH","","RIVERSIDE PUBLIC CONVENIENCES, WICK LANE, BOURNEMOUTH","EAST SOUTHBOURNE AND TUCKTON","Commercial","Community Services","Public Conveniences",415206.0700,92159.2500,"Approved Preferred","Visual centre","RIVERSIDE PUBLIC CONVENIENCES, WICK LANE"
10023870310,"","","SOUTHBOURNE CROSSROADS PUBLIC CONVENIENCES","","SOUTHBOURNE OVERCLIFF DRIVE","","BOURNEMOUTH","","SOUTHBOURNE CROSSROADS PUBLIC CONVENIENCES, SOUTHBOURNE OVERCLIFF DRIVE, BOURNEMOUTH","EAST SOUTHBOURNE AND TUCKTON","Commercial","Community Services","Public Conveniences",414344.5800,91326.1900,"Approved Preferred","Visual centre","SOUTHBOURNE CROSSROADS PUBLIC CONVENIENCES, SOUTHBOURNE OVERCLIFF DRIVE"
10023870311,"","WALLISDOWN PLAYING FIELDS PUBLIC CONVENIENCES","WALLISDOWN PLAYING FIELDS","","WALLISDOWN ROAD","","BOURNEMOUTH","","WALLISDOWN PLAYING FIELDS PUBLIC CONVENIENCES, WALLISDOWN PLAYING FIELDS, WALLISDOWN ROAD, BOURNEMOUTH","WALLISDOWN AND WINTON WEST","Commercial","Community Services","Public Conveniences",406639.4000,94010.3300,"Approved Preferred","Visual centre","WALLISDOWN PLAYING FIELDS, WALLISDOWN ROAD"
10023870312,"","","WEST OVERCLIFF PUBLIC CONVENIENCES","","WEST OVERCLIFF GARDENS","","BOURNEMOUTH","","WEST OVERCLIFF PUBLIC CONVENIENCES, WEST OVERCLIFF GARDENS, BOURNEMOUTH","WESTBOURNE AND WEST CLIFF","Commercial","Community Services","Public Conveniences",408193.4300,90616.2200,"Approved Preferred","Visual centre","WEST OVERCLIFF PUBLIC CONVENIENCES, WEST OVERCLIFF GARDENS"
10023870313,"","","ALUM CHINE PUBLIC CONVENIENCES","","ALUM CHINE GARDENS","","BOURNEMOUTH","","ALUM CHINE PUBLIC CONVENIENCES, ALUM CHINE GARDENS, BOURNEMOUTH","WESTBOURNE AND WEST CLIFF","Commercial","Community Services","Public Conveniences",407436.8900,90222.2500,"Approved Preferred","Visual centre","ALUM CHINE PUBLIC CONVENIENCES, ALUM CHINE GARDENS"
10023870314,"","","BEDFORD BEACH PUBLIC CONVENIENCES","","SOUTHBOURNE PROMENADE","","BOURNEMOUTH","","BEDFORD BEACH PUBLIC CONVENIENCES, SOUTHBOURNE PROMENADE, BOURNEMOUTH","EAST SOUTHBOURNE AND TUCKTON","Commercial","Community Services","Public Conveniences",414567.6200,91125.2800,"Approved Preferred","Visual centre","BEDFORD BEACH PUBLIC CONVENIENCES, SOUTHBOURNE PROMENADE"
10023870315,"","","BOSCOMBE EAST PUBLIC CONVENIENCES","","BOSCOMBE PROMENADE","","BOURNEMOUTH","","BOSCOMBE EAST PUBLIC CONVENIENCES, BOSCOMBE PROMENADE, BOURNEMOUTH","BOSCOMBE EAST","Commercial","Community Services","Public Conveniences",411567.8200,91210.8300,"Approved Preferred","Visual centre","BOSCOMBE EAST PUBLIC CONVENIENCES, BOSCOMBE PROMENADE"
10023870316,"","PUBLIC CONVENIENCES","BOSCOMBE PIER","","SEA ROAD","BOSCOMBE","BOURNEMOUTH","","PUBLIC CONVENIENCES, BOSCOMBE PIER, SEA ROAD, BOSCOMBE, BOURNEMOUTH","BOSCOMBE WEST","Commercial","Community Services","Public Conveniences",411157.3700,91136.6100,"Approved Preferred","Visual centre","BOSCOMBE PIER, SEA ROAD"
10023870317,"","","BOURNEMOUTH EAST PUBLIC CONVENIENCES","","UNDERCLIFF DRIVE","","BOURNEMOUTH","","BOURNEMOUTH EAST PUBLIC CONVENIENCES, UNDERCLIFF DRIVE, BOURNEMOUTH","CENTRAL","Commercial","Community Services","Public Conveniences",409047.0700,90776.8400,"Approved Preferred","Visual centre","BOURNEMOUTH EAST PUBLIC CONVENIENCES, UNDERCLIFF DRIVE"
10023870318,"","","BOURNEMOUTH PIER PUBLIC CONVENIENCES","","PIER APPROACH","","BOURNEMOUTH","","BOURNEMOUTH PIER PUBLIC CONVENIENCES, PIER APPROACH, BOURNEMOUTH","CENTRAL","Commercial","Community Services","Public Conveniences",408874.0000,90726.0000,"Approved Preferred","Visual centre","BOURNEMOUTH PIER PUBLIC CONVENIENCES, PIER APPROACH"
10023870319,"","","BOURNEMOUTH WEST PUBLIC CONVENIENCES","","WEST UNDERCLIFF PROMENADE","","BOURNEMOUTH","","BOURNEMOUTH WEST PUBLIC CONVENIENCES, WEST UNDERCLIFF PROMENADE, BOURNEMOUTH","WESTBOURNE AND WEST CLIFF","Commercial","Community Services","Public Conveniences",408705.9700,90666.5800,"Approved Preferred","Visual centre","BOURNEMOUTH WEST PUBLIC CONVENIENCES, WEST UNDERCLIFF PROMENADE"
10023870320,"","","DURLEY CHINE PUBLIC CONVENIENCES","","WEST UNDERCLIFF PROMENADE","","BOURNEMOUTH","","DURLEY CHINE PUBLIC CONVENIENCES, WEST UNDERCLIFF PROMENADE, BOURNEMOUTH","WESTBOURNE AND WEST CLIFF","Commercial","Community Services","Public Conveniences",408034.1900,90473.5800,"Approved Preferred","Visual centre","DURLEY CHINE PUBLIC CONVENIENCES, WEST UNDERCLIFF PROMENADE"
10023870321,"","","EAST UNDERCLIFF PUBLIC CONVENIENCES","","UNDERCLIFF DRIVE","","BOURNEMOUTH","","EAST UNDERCLIFF PUBLIC CONVENIENCES, UNDERCLIFF DRIVE, BOURNEMOUTH","EAST CLIFF AND SPRINGBOURNE","Commercial","Community Services","Public Conveniences",409638.4100,90921.3600,"Approved Preferred","Visual centre","EAST UNDERCLIFF PUBLIC CONVENIENCES, UNDERCLIFF DRIVE"
10023870322,"","","FISHERMANS FORESHORE PUBLIC CONVENIENCES","","BOSCOMBE PROMENADE","","BOURNEMOUTH","","FISHERMANS FORESHORE PUBLIC CONVENIENCES, BOSCOMBE PROMENADE, BOURNEMOUTH","BOSCOMBE EAST","Commercial","Community Services","Public Conveniences",412856.4000,91276.3100,"Approved Preferred","Visual centre","FISHERMANS FORESHORE PUBLIC CONVENIENCES, BOSCOMBE PROMENADE"
10023870323,"","","GORDON STEPS PUBLIC CONVENIENCES","","SOUTHBOURNE PROMENADE","","BOURNEMOUTH","","GORDON STEPS PUBLIC CONVENIENCES, SOUTHBOURNE PROMENADE, BOURNEMOUTH","WEST SOUTHBOURNE","Commercial","Community Services","Public Conveniences",413434.2200,91265.7300,"Approved Preferred","Visual centre","GORDON STEPS PUBLIC CONVENIENCES, SOUTHBOURNE PROMENADE"
10023870324,"","","HONEYCOMBE CHINE PUBLIC CONVENIENCES","","BOSCOMBE PROMENADE","","BOURNEMOUTH","","HONEYCOMBE CHINE PUBLIC CONVENIENCES, BOSCOMBE PROMENADE, BOURNEMOUTH","BOSCOMBE WEST","Commercial","Community Services","Public Conveniences",411324.0400,91184.3300,"Approved Preferred","Visual centre","HONEYCOMBE CHINE PUBLIC CONVENIENCES, BOSCOMBE PROMENADE"
10023870325,"","","MANOR STEPS PUBLIC CONVENIENCES","","BOSCOMBE PROMENADE","","BOURNEMOUTH","","MANOR STEPS PUBLIC CONVENIENCES, BOSCOMBE PROMENADE, BOURNEMOUTH","BOSCOMBE EAST","Commercial","Community Services","Public Conveniences",411912.4800,91260.7900,"Approved Preferred","Visual centre","MANOR STEPS PUBLIC CONVENIENCES, BOSCOMBE PROMENADE"
10023870326,"","","PORTMAN RAVINE PUBLIC CONVENIENCES","","BOSCOMBE PROMENADE","","BOURNEMOUTH","","PORTMAN RAVINE PUBLIC CONVENIENCES, BOSCOMBE PROMENADE, BOURNEMOUTH","BOSCOMBE EAST","Commercial","Community Services","Public Conveniences",412538.6900,91272.2100,"Approved Preferred","Visual centre","PORTMAN RAVINE PUBLIC CONVENIENCES, BOSCOMBE PROMENADE"
10023870327,"","","SOLENT BEACH PUBLIC CONVENIENCES","","SOUTHBOURNE PROMENADE","","BOURNEMOUTH","","SOLENT BEACH PUBLIC CONVENIENCES, SOUTHBOURNE PROMENADE, BOURNEMOUTH","EAST SOUTHBOURNE AND TUCKTON","Commercial","Community Services","Public Conveniences",414807.1300,91087.8900,"Approved Preferred","Visual centre","SOLENT BEACH PUBLIC CONVENIENCES, SOUTHBOURNE PROMENADE"
10023870328,"","","TOFT STEPS PUBLIC CONVENIENCES","","UNDERCLIFF DRIVE","","BOURNEMOUTH","","TOFT STEPS PUBLIC CONVENIENCES, UNDERCLIFF DRIVE, BOURNEMOUTH","EAST CLIFF AND SPRINGBOURNE","Commercial","Community Services","Public Conveniences",410678.8000,91109.5100,"Approved Preferred","Visual centre","TOFT STEPS PUBLIC CONVENIENCES, UNDERCLIFF DRIVE"
10023870329,"","","BOSCOMBE GARDENS PUBLIC CONVENIENCES","","BOSCOMBE CHINE GARDENS","","BOURNEMOUTH","","BOSCOMBE GARDENS PUBLIC CONVENIENCES, BOSCOMBE CHINE GARDENS, BOURNEMOUTH","EAST CLIFF AND SPRINGBOURNE","Commercial","Community Services","Public Conveniences",410780.8300,91521.0500,"Approved Preferred","Visual centre","BOSCOMBE GARDENS PUBLIC CONVENIENCES, BOSCOMBE CHINE GARDENS"
10023870330,"","PUBLIC CONVENIENCES","BOSCOMBE OVERCLIFF GARDENS","","BOSCOMBE CLIFF ROAD","","BOURNEMOUTH","BH5 1DH","PUBLIC CONVENIENCES, BOSCOMBE OVERCLIFF GARDENS, BOSCOMBE CLIFF ROAD, BOURNEMOUTH, BH5 1DH","BOSCOMBE WEST","Commercial","Community Services","Public Conveniences",411524.4900,91285.3300,"Approved Preferred","Visual centre","BOSCOMBE OVERCLIFF GARDENS, BOSCOMBE CLIFF ROAD"
10023870331,"","","ARGYLL GARDENS PUBLIC CONVENIENCES","","WEST OVERCLIFF DRIVE","","BOURNEMOUTH","","ARGYLL GARDENS PUBLIC CONVENIENCES, WEST OVERCLIFF DRIVE, BOURNEMOUTH","WESTBOURNE AND WEST CLIFF","Commercial","Community Services","Public Conveniences",407558.9978,90367.0020,"Approved Preferred","Visual centre","ARGYLL GARDENS PUBLIC CONVENIENCES, WEST OVERCLIFF DRIVE"
10023870332,"","","KNYVETON GARDENS PUBLIC CONVENIENCES","","KNYVETON GARDENS","","BOURNEMOUTH","","KNYVETON GARDENS PUBLIC CONVENIENCES, KNYVETON GARDENS, BOURNEMOUTH","EAST CLIFF AND SPRINGBOURNE","Commercial","Community Services","Public Conveniences",410169.2900,91829.1500,"Approved Preferred","Visual centre","KNYVETON GARDENS PUBLIC CONVENIENCES, KNYVETON GARDENS"
10023870333,"","","MEYRICK PARK PUBLIC CONVENIENCES","","MEYRICK PARK","","BOURNEMOUTH","","MEYRICK PARK PUBLIC CONVENIENCES, MEYRICK PARK, BOURNEMOUTH","TALBOT AND BRANKSOME WOODS","Commercial","Community Services","Public Conveniences",408380.2100,91942.5200,"Approved Preferred","Visual centre","MEYRICK PARK PUBLIC CONVENIENCES, MEYRICK PARK"
10023870334,"","","SEAFIELD ROAD PUBLIC CONVENIENCES","","SEAFIELD ROAD","","BOURNEMOUTH","","SEAFIELD ROAD PUBLIC CONVENIENCES, SEAFIELD ROAD, BOURNEMOUTH","EAST SOUTHBOURNE AND TUCKTON","Commercial","Community Services","Public Conveniences",414199.8200,91684.8600,"Approved Preferred","Visual centre","SEAFIELD ROAD PUBLIC CONVENIENCES, SEAFIELD ROAD"
10024391878,"HOLDENHURST ROAD PUBLIC CONVENIENCES","","HOLDENHURST ROAD PUBLIC CONVENIENCES","","HOLDENHURST ROAD","","BOURNEMOUTH","BH8 8BX","HOLDENHURST ROAD PUBLIC CONVENIENCES, HOLDENHURST ROAD, BOURNEMOUTH, BH8 8BX","EAST CLIFF AND SPRINGBOURNE","Commercial","Community Services","Public Conveniences",410548.8400,92521.1900,"Approved Preferred","Visual centre","HOLDENHURST ROAD PUBLIC CONVENIENCES, HOLDENHURST ROAD"
10024391879,"KINGS ROAD PUBLIC CONVENIENCES","","KINGS ROAD PUBLIC CONVENIENCES","","KINGS ROAD","","BOURNEMOUTH","BH3 7LD","KINGS ROAD PUBLIC CONVENIENCES, KINGS ROAD, BOURNEMOUTH, BH3 7LD","TALBOT AND BRANKSOME WOODS","Commercial","Community Services","Public Conveniences",409583.0400,93007.7000,"Approved Preferred","Visual centre","KINGS ROAD PUBLIC CONVENIENCES, KINGS ROAD"
10024391898,"CEMETRY JUNCTION PUBLIC CONVENIENCE","","CEMETRY JUNCTION PUBLIC CONVENIENCE","","WIMBORNE ROAD","","BOURNEMOUTH","BH3 7AA","CEMETRY JUNCTION PUBLIC CONVENIENCE, WIMBORNE ROAD, BOURNEMOUTH, BH3 7AA","TALBOT AND BRANKSOME WOODS","Commercial","Community Services","Public Conveniences",408933.2100,92563.3900,"Approved Preferred","Visual centre","CEMETRY JUNCTION PUBLIC CONVENIENCE, WIMBORNE ROAD"
10024391901,"WIMBORNE ROAD PUBLIC CONVENIENCES","","WIMBORNE ROAD PUBLIC CONVENIENCES","","WIMBORNE ROAD","","BOURNEMOUTH","BH9 2EX","WIMBORNE ROAD PUBLIC CONVENIENCES, WIMBORNE ROAD, BOURNEMOUTH, BH9 2EX","WINTON EAST","Commercial","Community Services","Public Conveniences",408659.6300,93891.2700,"Approved Preferred","Visual centre","WIMBORNE ROAD PUBLIC CONVENIENCES, WIMBORNE ROAD"
10024391903,"KINSON ROAD PUBLIC CONVENIENCE","","KINSON ROAD PUBLIC CONVENIENCE","","KINSON ROAD","","BOURNEMOUTH","BH10 4AJ","KINSON ROAD PUBLIC CONVENIENCE, KINSON ROAD, BOURNEMOUTH, BH10 4AJ","WALLISDOWN AND WINTON WEST","Commercial","Community Services","Public Conveniences",406531.5400,94145.8500,"Approved Preferred","Visual centre","KINSON ROAD PUBLIC CONVENIENCE, KINSON ROAD"
10024392984,"","PUBLIC CONVENIENCES","ATHLETIC CENTRE","","KINGS PARK DRIVE","","BOURNEMOUTH","BH7 7AF","PUBLIC CONVENIENCES, ATHLETIC CENTRE, BOURNEMOUTH, BH7 7AF","LITTLEDOWN AND IFORD","Commercial","Community Services","Public Conveniences",411783.6300,92714.3700,"Approved Preferred","Visual centre","ATHLETIC CENTRE, KINGS PARK DRIVE"
10024392985,"","PUBLIC CONVENIENCES","BOURNEMOUTH GARDENS TENNIS CENTRE","","CENTRAL GARDENS","","BOURNEMOUTH","BH2 6EY","PUBLIC CONVENIENCES, BOURNEMOUTH GARDENS TENNIS CENTRE, CENTRAL GARDENS, BOURNEMOUTH, BH2 6EY","CENTRAL","Commercial","Community Services","Public Conveniences",408199.8700,91403.3500,"Approved Preferred","Visual centre","BOURNEMOUTH GARDENS TENNIS CENTRE, CENTRAL GARDENS"
10024392986,"","","IFORD FOOTBALL PAVILLION PUBLIC CONVENIENCES","","IFORD LANE","","BOURNEMOUTH","BH6 5NF","IFORD FOOTBALL PAVILLION PUBLIC CONVENIENCES, IFORD LANE, BOURNEMOUTH, BH6 5NF","EAST SOUTHBOURNE AND TUCKTON","Commercial","Community Services","Public Conveniences",414449.9973,92691.9964,"Approved Preferred","Visual centre","IFORD FOOTBALL PAVILLION PUBLIC CONVENIENCES, IFORD LANE"
10024392987,"","PUBLIC CONVENIENCES","KINGS PARK PAVILION","","KINGS PARK CENTRAL DRIVE","","BOURNEMOUTH","BH1 4NN","PUBLIC CONVENIENCES, KINGS PARK PAVILION, BOURNEMOUTH, BH1 4NN","LITTLEDOWN AND IFORD","Commercial","Community Services","Public Conveniences",411335.3900,92632.7300,"Approved Preferred","Visual centre","KINGS PARK PAVILION, KINGS PARK CENTRAL DRIVE"
10024392988,"","PUBLIC CONVENIENCES","PAVILION","","ENDFIELD ROAD","","BOURNEMOUTH","BH9 1TH","PUBLIC CONVENIENCES, PAVILION, ENDFIELD ROAD, BOURNEMOUTH, BH9 1TH","MOORDOWN","Commercial","Community Services","Public Conveniences",409209.2200,94649.7400,"Approved Preferred","Visual centre","PAVILION, ENDFIELD ROAD"
10024392989,"","PUBLIC CONVENIENCES","MUSCLIFFE COMMUNITY CENTRE","","SHILLINGSTONE DRIVE","","BOURNEMOUTH","BH9 3LR","PUBLIC CONVENIENCES, MUSCLIFFE COMMUNITY CENTRE, SHILLINGSTONE DRIVE, BOURNEMOUTH, BH9 3LR","THROOP AND MUSCLIFF","Commercial","Community Services","Public Conveniences",410106.0000,95662.0000,"Approved Preferred","Visual centre","MUSCLIFFE COMMUNITY CENTRE, SHILLINGSTONE DRIVE"
10024392991,"","PUBLIC CONVENIENCES","SWANMORE BOWLING CLUB","","SWANMORE ROAD","","BOURNEMOUTH","BH7 6PD","PUBLIC CONVENIENCES, SWANMORE BOWLING CLUB, SWANMORE ROAD, BOURNEMOUTH, BH7 6PD","LITTLEDOWN AND IFORD","Commercial","Community Services","Public Conveniences",412947.2400,93111.4600,"Approved Preferred","Visual centre","SWANMORE BOWLING CLUB, SWANMORE ROAD"
10024392992,"","PUBLIC CONVENIENCES","WINTON RECREATION GROUND","","FITZHARRIS AVENUE","","BOURNEMOUTH","BH9 1BX","PUBLIC CONVENIENCES, WINTON RECREATION GROUND, FITZHARRIS AVENUE, BOURNEMOUTH, BH9 1BX","WINTON EAST","Commercial","Community Services","Public Conveniences",409458.9200,93362.0200,"Approved Preferred","Visual centre","WINTON RECREATION GROUND, FITZHARRIS AVENUE"
10024393278,"PUBLIC CONVENIENCES","PUBLIC CONVENIENCES","BOWLS PAVILION","","MILLHAMS ROAD","","BOURNEMOUTH","BH10 7LH","PUBLIC CONVENIENCES, BOWLS PAVILION, MILLHAMS ROAD, BOURNEMOUTH, BH10 7LH","KINSON NORTH","Commercial","Community Services","Public Conveniences",407111.0000,96881.0000,"Approved Preferred","Visual centre","BOWLS PAVILION, MILLHAMS ROAD"
10024393279,"PUBLIC CONVENIENCES","PUBLIC CONVENIENCES","REDHILL PARK BOWLING CLUB","","REDHILL AVENUE","","BOURNEMOUTH","BH9 2SW","PUBLIC CONVENIENCES, REDHILL PARK BOWLING CLUB, REDHILL AVENUE, BOURNEMOUTH, BH9 2SW","REDHILL AND NORTHBOURNE","Commercial","Community Services","Public Conveniences",408251.0000,94878.0000,"Approved Preferred","Visual centre","REDHILL PARK BOWLING CLUB, REDHILL AVENUE"
10024393281,"PUBLIC CONVENIENCES BLOCK A","PUBLIC CONVENIENCES BLOCK A","SLADES FARM SPORTS PAVILLION","","ENSBURY AVENUE","","BOURNEMOUTH","BH10 4HG","PUBLIC CONVENIENCES BLOCK A, SLADES FARM SPORTS PAVILLION, ENSBURY AVENUE, BOURNEMOUTH, BH10 4HG","WALLISDOWN AND WINTON WEST","Commercial","Community Services","Public Conveniences",407522.1800,94271.0500,"Approved Preferred","Visual centre","SLADES FARM SPORTS PAVILLION, ENSBURY AVENUE"
10024393282,"PUBLIC CONVENIENCES BLOCK B","PUBLIC CONVENIENCES BLOCK B","SLADES FARM SPORTS PAVILLION","","ENSBURY AVENUE","","BOURNEMOUTH","BH10 4HG","PUBLIC CONVENIENCES BLOCK B, SLADES FARM SPORTS PAVILLION, ENSBURY AVENUE, BOURNEMOUTH, BH10 4HG","WALLISDOWN AND WINTON WEST","Commercial","Community Services","Public Conveniences",407522.1800,94271.0500,"Approved Preferred","Visual centre","SLADES FARM SPORTS PAVILLION, ENSBURY AVENUE"
10024393283,"PUBLIC CONVENIENCES","PUBLIC CONVENIENCES","SOLENT MEADS GOLF CLUB","","ROLLS DRIVE","","BOURNEMOUTH","BH6 4NA","PUBLIC CONVENIENCES, SOLENT MEADS GOLF CLUB, ROLLS DRIVE, BOURNEMOUTH, BH6 4NA","EAST SOUTHBOURNE AND TUCKTON","Commercial","Community Services","Public Conveniences",415805.1700,91599.6600,"Approved Preferred","Visual centre","SOLENT MEADS GOLF CLUB, ROLLS DRIVE"
10024393284,"PUBLIC CONVENIENCES","PUBLIC CONVENIENCES","MEYRICK PARK GOLF CLUB AND SQUASH PAVILION","","MEYRICK PARK","","BOURNEMOUTH","BH2 6LH","PUBLIC CONVENIENCES, MEYRICK PARK GOLF CLUB AND SQUASH PAVILION, MEYRICK PARK, BOURNEMOUTH, BH2 6LH","TALBOT AND BRANKSOME WOODS","Commercial","Community Services","Public Conveniences",408281.0000,91743.0000,"Approved Preferred","Visual centre","MEYRICK PARK GOLF CLUB AND SQUASH PAVILION, MEYRICK PARK"
10024393285,"PUBLIC CONVENIENCES","PUBLIC CONVENIENCES","KINSON MANOR PLAYING FIELDS","","HORSHAM AVENUE","","BOURNEMOUTH","BH10 7EY","PUBLIC CONVENIENCES, KINSON MANOR PLAYING FIELDS, HORSHAM AVENUE, BOURNEMOUTH, BH10 7EY","KINSON NORTH","Commercial","Community Services","Public Conveniences",407650.0000,96852.0000,"Approved Preferred","Visual centre","KINSON MANOR PLAYING FIELDS, HORSHAM AVENUE"
10024394296,"CHRISTCHURCH BOROUGH COUNCIL","BLOCK 1","PUBLIC CONVENIENCES","","HENGISTBURY HEAD","","BOURNEMOUTH","BH23 4EW","CHRISTCHURCH BOROUGH COUNCIL, BLOCK 1, PUBLIC CONVENIENCES, BOURNEMOUTH, BH23 4EW","EAST SOUTHBOURNE AND TUCKTON","Commercial","Community Services","Public Conveniences",418135.3000,90888.0800,"Approved Preferred","Visual centre","PUBLIC CONVENIENCES, HENGISTBURY HEAD"
10024394297,"CHRISTCHURCH BOROUGH COUNCIL","BLOCK 2","PUBLIC CONVENIENCES","","HENGISTBURY HEAD","","BOURNEMOUTH","BH23 4EW","CHRISTCHURCH BOROUGH COUNCIL, BLOCK 2, PUBLIC CONVENIENCES, BOURNEMOUTH, BH23 4EW","EAST SOUTHBOURNE AND TUCKTON","Commercial","Community Services","Public Conveniences",418265.9600,91135.0300,"Approved Preferred","Visual centre","PUBLIC CONVENIENCES, HENGISTBURY HEAD"
