"UPRN","ORGANISATION","Sub_Building_No","Sub_Building_Name","Building_Number","THOROUGHFARE","LOCALITY","TOWN","POSTCODE","FULL_ADDRESS","WARD_NAME","PRIMARY_DESCRIPTION","SECONDARY_DESCRIPTION","TERTIARY_DESCRIPTION","X","Y","LOGICAL_STATUS","RPA_DESCRIPTION","PARTIAL_ADDRESS"
10024394298,"CHRISTCHURCH BOROUGH COUNCIL","BLOCK 3","PUBLIC CONVENIENCES","","HENGISTBURY HEAD","","BOURNEMOUTH","BH23 4EW","CHRISTCHURCH BOROUGH COUNCIL, BLOCK 3, PUBLIC CONVENIENCES, BOURNEMOUTH, BH23 4EW","EAST SOUTHBOURNE AND TUCKTON","Commercial","Community Services","Public Conveniences",418281.5000,91305.8300,"Approved Preferred","Visual centre","PUBLIC CONVENIENCES, HENGISTBURY HEAD"
10024394299,"CHRISTCHURCH BOROUGH COUNCIL","BLOCK 4","PUBLIC CONVENIENCES","","HENGISTBURY HEAD","","BOURNEMOUTH","BH23 4EW","CHRISTCHURCH BOROUGH COUNCIL, BLOCK 4, PUBLIC CONVENIENCES, BOURNEMOUTH, BH23 4EW","EAST SOUTHBOURNE AND TUCKTON","Commercial","Community Services","Public Conveniences",418265.0000,91357.0000,"Approved Preferred","Visual centre","PUBLIC CONVENIENCES, HENGISTBURY HEAD"
10024394300,"","PUBLIC CONVENIENCES","SOVEREIGN CENTRE","600","CHRISTCHURCH ROAD","","BOURNEMOUTH","BH1 4SX","PUBLIC CONVENIENCES, SOVEREIGN CENTRE, 600 CHRISTCHURCH ROAD, BOURNEMOUTH, BH1 4SX","BOSCOMBE WEST","Commercial","Community Services","Public Conveniences",411328.2500,91950.6900,"Approved Preferred","Visual centre","600 CHRISTCHURCH ROAD"
10024394309,"","PUBLIC CONVENIENCES","QUEENS PARK GOLF COURSE AND PAVILION","","QUEENS PARK WEST DRIVE","","BOURNEMOUTH","BH8 9BY","PUBLIC CONVENIENCES, QUEENS PARK GOLF COURSE AND PAVILION, QUEENS PARK WEST DRIVE, BOURNEMOUTH, BH8 9BY","QUEEN'S PARK","Commercial","Community Services","Public Conveniences",410668.0000,93215.0000,"Approved Preferred","Visual centre","QUEENS PARK GOLF COURSE AND PAVILION, QUEENS PARK WEST DRIVE"
10024394790,"HORSESHOE COMMON PUBLIC CONVENIENCES","HORSESHOE COMMON PUBLIC CONVENIENCES","HORSESHOE COMMON","","OLD CHRISTCHURCH ROAD","","BOURNEMOUTH","BH1 1NL","HORSESHOE COMMON PUBLIC CONVENIENCES, HORSESHOE COMMON, OLD CHRISTCHURCH ROAD, BOURNEMOUTH, BH1 1NL","CENTRAL","Commercial","Community Services","Public Conveniences",409102.9500,91433.0000,"Approved Preferred","Visual centre","HORSESHOE COMMON, OLD CHRISTCHURCH ROAD"
10024395925,"","PUBLIC CONVENIENCES","APCOA CAR PARK","","AVENUE ROAD","","BOURNEMOUTH","BH2 5SH","PUBLIC CONVENIENCES, APCOA CAR PARK, AVENUE ROAD, BOURNEMOUTH, BH2 5SH","CENTRAL","Commercial","Community Services","Public Conveniences",408273.0000,91316.0000,"Approved Preferred","Visual centre","APCOA CAR PARK, AVENUE ROAD"
10024395942,"","PUBLIC CONVENIENCES","BOSCOMBE CLIFF BOWLING CLUB","","WOODLAND AVENUE","","BOURNEMOUTH","BH5 2DJ","PUBLIC CONVENIENCES, BOSCOMBE CLIFF BOWLING CLUB, WOODLAND AVENUE, BOURNEMOUTH, BH5 2DJ","BOSCOMBE EAST","Commercial","Community Services","Public Conveniences",412350.1500,91466.1100,"Approved Preferred","Visual centre","BOSCOMBE CLIFF BOWLING CLUB, WOODLAND AVENUE"
10024395949,"","","PUBLIC CONVENIENCES","","CHASESIDE","","BOURNEMOUTH","BH7 7DX","PUBLIC CONVENIENCES, CHASESIDE, BOURNEMOUTH, BH7 7DX","LITTLEDOWN AND IFORD","Commercial","Community Services","Public Conveniences",412346.3900,93937.2400,"Approved Preferred","Visual centre","PUBLIC CONVENIENCES, CHASESIDE"
10090818195,"","PUBLIC CONVENIENCES","CASTLEPOINT","","CASTLE LANE WEST","","BOURNEMOUTH","BH8 9UZ","PUBLIC CONVENIENCES, CASTLEPOINT, CASTLE LANE WEST, BOURNEMOUTH, BH8 9UZ","STROUDEN PARK","Commercial","Community Services","Public Conveniences",411116.9300,94764.3700,"Approved Preferred","Visual centre","CASTLEPOINT, CASTLE LANE WEST"
10090818655,"","FEMALE PUBLIC CONVENIENCES","WIMBORNE ROAD PUBLIC CONVENIENCES","","WIMBORNE ROAD","","BOURNEMOUTH","BH9 2EX","FEMALE PUBLIC CONVENIENCES, WIMBORNE ROAD PUBLIC CONVENIENCES, WIMBORNE ROAD, BOURNEMOUTH, BH9 2EX","WINTON EAST","Commercial","Community Services","Public Conveniences",408659.6300,93891.2700,"Approved Preferred","Visual centre","WIMBORNE ROAD PUBLIC CONVENIENCES, WIMBORNE ROAD"
10090818656,"","MALE PUBLIC CONVENIENCES","WIMBORNE ROAD PUBLIC CONVENIENCES","","WIMBORNE ROAD","","BOURNEMOUTH","BH9 2EX","MALE PUBLIC CONVENIENCES, WIMBORNE ROAD PUBLIC CONVENIENCES, WIMBORNE ROAD, BOURNEMOUTH, BH9 2EX","WINTON EAST","Commercial","Community Services","Public Conveniences",408659.6300,93891.2700,"Approved Preferred","Visual centre","WIMBORNE ROAD PUBLIC CONVENIENCES, WIMBORNE ROAD"
10090818733,"","CHANGING ROOMS","IFORD LANE CLUBHOUSE","","IFORD LANE","","BOURNEMOUTH","BH6 5NF","CHANGING ROOMS, IFORD LANE CLUBHOUSE, IFORD LANE, BOURNEMOUTH, BH6 5NF","EAST SOUTHBOURNE AND TUCKTON","Commercial","Community Services","Public Conveniences",414467.5900,92682.9800,"Approved Preferred","Visual centre","IFORD LANE CLUBHOUSE, IFORD LANE"
